{
  "$schema": "http://json-schema.org/draft-07/schema#",
  "$id": "https://gnus.ai/schemas/processing-definition/v1.0/schema.json",
  "title": "GNUS.ai Processing Definition",
  "description": "Schema for defining AI inference and retraining workflows with shader passes",
  "type": "object",
  "required": ["name", "version", "gnus_spec_version", "passes", "inputs", "outputs"],
  "properties": {
    "name": {
      "type": "string",
      "description": "Unique name for this processing definition",
      "pattern": "^[A-Za-z0-9_-]+$"
    },
    "version": {
      "type": "string",
      "description": "Version of this processing definition",
      "pattern": "^\\d+\\.\\d+(\\.\\d+)?$"
    },
    "gnus_spec_version": {
      "type": "number", 
      "description": "Version of the GNUS processing definition specification",
	  "minimum": 1.0,
	  "maximum": 1.0
    },
    "author": {
      "type": "string",
      "description": "Author of this processing definition"
    },
    "description": {
      "type": "string",
      "description": "Human-readable description of what this processing definition does"
    },
    "tags": {
      "type": "array",
      "description": "Tags for categorizing this definition",
      "items": {
        "type": "string"
      }
    },
    "inputs": {
      "type": "array",
      "description": "Declares the external inputs this process requires",
      "minItems": 1,
      "items": {
        "$ref": "#/definitions/io_declaration"
      }
    },
    "outputs": {
      "type": "array",
      "description": "Declares the final outputs this process will produce",
      "minItems": 1,
      "items": {
        "$ref": "#/definitions/io_declaration"
      }
    },
    "parameters": {
      "type": "array",
      "description": "Overridable parameters with defaults",
      "items": {
        "$ref": "#/definitions/parameter"
      }
    },
    "passes": {
      "type": "array",
      "description": "Array of processing passes to execute",
      "minItems": 1,
      "items": {
        "$ref": "#/definitions/pass"
      }
    },
    "metadata": {
      "type": "object",
      "description": "Additional metadata for the processing definition",
      "additionalProperties": true
    }
  },
  "definitions": {
    "io_declaration": {
      "type": "object",
      "required": ["source_uri_param", "name", "type"],
      "properties": {
        "name": {
          "type": "string",
          "description": "Unique identifier for this input/output",
          "pattern": "^[a-zA-Z][a-zA-Z0-9_]*$"
        },
		"source_uri_param": {
          "type": "string",
          "description": "Parameter name that contains the input URI"
        },
        "type": {
          "$ref": "#/definitions/data_type"
        },
        "description": {
          "type": "string",
          "description": "Human-readable description"
        },
        "dimensions": {
          "type": "object",
          "description": "Optional dimensions specification",
          "properties": {
            "width": { "type": "integer", "minimum": 1 },
            "height": { "type": "integer", "minimum": 1 },
			"block_len": { "type": "integer", "minimum": 1 },
			"block_line_stride": { "type": "integer", "minimum": 1 },
			"block_stride": { "type": "integer", "minimum": 0 },
			"chunk_line_stride": { "type": "integer", "minimum": 1 },
			"chunk_offset": { "type": "integer", "minimum": 0 },
			"chunk_stride": { "type": "integer", "minimum": 1 },
			"chunk_subchunk_height": { "type": "integer", "minimum": 1 },
			"chunk_subchunk_width": { "type": "integer", "minimum": 1 },
			"chunk_count": { "type": "integer", "minimum": 1 },
            "batch": { "type": "integer", "minimum": 1 }
          }
        },
        "format": {
          "type": "string",
          "description": "Data format (e.g., RGBA8, FLOAT32)",
          "enum": ["RGBA8", "RGB8", "FLOAT32", "FLOAT16", "INT32", "INT16", "INT8", "FP4_ULTRA"]
        }
      }
    },
    "parameter": {
      "type": "object",
      "required": ["name", "type"],
      "properties": {
        "name": {
          "type": "string",
          "description": "Parameter name",
          "pattern": "^[a-zA-Z][a-zA-Z0-9_]*$"
        },
        "type": {
          "type": "string",
          "enum": ["float", "int", "bool", "string", "uri", "array", "object"]
        },
        "default": {
          "description": "Default value for this parameter"
        },
        "description": {
          "type": "string"
        },
        "constraints": {
          "type": "object",
          "properties": {
            "min": { "type": "number" },
            "max": { "type": "number" },
            "enum": { "type": "array" },
            "pattern": { "type": "string" }
          }
        }
      }
    },
    "pass": {
      "type": "object",
      "required": ["name", "type"],
      "properties": {
        "name": {
          "type": "string",
          "description": "Unique name for this pass",
          "pattern": "^[a-zA-Z][a-zA-Z0-9_]*$"
        },
        "type": {
          "type": "string",
          "enum": ["inference", "retrain", "compute", "render", "data_transform"],
          "description": "Type of processing pass"
        },
        "description": {
          "type": "string"
        },
        "enabled": {
          "type": "boolean",
          "default": true,
          "description": "Whether this pass is enabled by default"
        },
        "model": {
          "$ref": "#/definitions/model_config",
          "description": "Model configuration for inference/retrain passes"
        },
        "shader": {
          "$ref": "#/definitions/shader_config",
          "description": "Shader configuration for compute passes"
        },
        "render_shader": {
          "$ref": "#/definitions/render_shader_config",
          "description": "Multi-stage (vertex+fragment) shader configuration for render passes"
        },
        "render_target": {
          "$ref": "#/definitions/render_target",
          "description": "Offscreen framebuffer (color+depth) config for render passes"
        },
        "vertex_layout": {
          "type": "array",
          "description": "Vertex attribute layout for render passes",
          "items": {
            "$ref": "#/definitions/vertex_layout_entry"
          }
        },
        "vertex_buffer": {
          "$ref": "#/definitions/vertex_buffer",
          "description": "Buffer binding supplying vertex attribute data referenced by vertex_layout (D-16 Amendment)"
        },
        "index_buffer": {
          "$ref": "#/definitions/index_buffer",
          "description": "Index buffer binding + index type for render passes"
        },
        "pipeline_state": {
          "$ref": "#/definitions/pipeline_state",
          "description": "Fixed-function pipeline state for render passes"
        },
        "data_transforms": {
          "type": "array",
          "description": "Data transformation pipeline",
          "items": {
            "$ref": "#/definitions/data_transform"
          }
        },
        "inputs": {
          "type": "array",
          "description": "Input bindings for non-model passes",
          "items": {
            "$ref": "#/definitions/pass_io_binding"
          }
        },
        "outputs": {
          "type": "array",
          "description": "Output bindings for non-model passes",
          "items": {
            "$ref": "#/definitions/pass_io_binding"
          }
        }
      },
      "allOf": [
        {
          "if": {
            "properties": { "type": { "enum": ["inference", "retrain"] } }
          },
          "then": {
            "required": ["model"]
          }
        },
        {
          "if": {
            "properties": { "type": { "const": "compute" } }
          },
          "then": {
            "required": ["shader"]
          }
        },
        {
          "if": {
            "properties": { "type": { "const": "render" } }
          },
          "then": {
            "required": ["render_shader", "render_target", "vertex_buffer"]
          }
        }
      ]
    },
    "model_config": {
      "type": "object",
      "required": ["source_uri_param", "input_nodes", "output_nodes", "format"],
      "properties": {
        "source_uri_param": {
          "type": "string",
          "description": "Parameter name that contains the model URI"
        },
        "format": {
          "type": "string",
          "enum": ["MNN", "ONNX", "TensorFlow", "PyTorch"],
          "default": "MNN",
          "description": "Model format"
        },
        "input_nodes": {
          "type": "array",
          "minItems": 1,
          "items": {
            "$ref": "#/definitions/model_node"
          }
        },
        "output_nodes": {
          "type": "array",
          "minItems": 1,
          "items": {
            "$ref": "#/definitions/model_node"
          }
        },
        "optimizer": {
          "$ref": "#/definitions/optimizer_config",
          "description": "Optimizer configuration for retrain passes"
        },
        "loss_function": {
          "type": "string",
          "description": "Loss function for training",
          "enum": ["mean_squared_error", "cross_entropy", "binary_cross_entropy", "l1_loss", "huber_loss", "custom"]
        },
        "batch_size": {
          "type": "integer",
          "minimum": 1,
          "default": 1
        }
      }
    },
	"model_node": {
	  "oneOf": [
		{
		  "type": "object",
		  "required": ["name", "type", "source"],
		  "properties": {
			"name": {
			  "type": "string",
			  "description": "Node name in the model graph"
			},
			"type": {
			  "$ref": "#/definitions/data_type"
			},
			"source": {
			  "type": "string",
			  "description": "Data source using prefix notation (input:, output:, internal:, parameter:)",
			  "pattern": "^(input|output|internal|parameter):[a-zA-Z][a-zA-Z0-9_]*$"
			},
			"shape": {
			  "type": "array",
			  "description": "Expected tensor shape",
			  "items": {
				"type": "integer",
				"minimum": -1
			  }
			}
		  },
		  "additionalProperties": false
		},
		{
		  "type": "object",
		  "required": ["name", "type", "target"],
		  "properties": {
			"name": {
			  "type": "string",
			  "description": "Node name in the model graph"
			},
			"type": {
			  "$ref": "#/definitions/data_type"
			},
			"target": {
			  "type": "string",
			  "description": "Data target using prefix notation",
			  "pattern": "^(output|internal):[a-zA-Z][a-zA-Z0-9_]*$"
			},
			"shape": {
			  "type": "array",
			  "description": "Expected tensor shape",
			  "items": {
				"type": "integer",
				"minimum": -1
			  }
			}
		  },
		  "additionalProperties": false
		}
	  ]
	},
    "shader_source_type": {
      "type": "string",
      "description": "Shader source language, validated before it ever reaches the driver",
      "enum": ["glsl", "spirv"]
    },
    "shader_config": {
      "type": "object",
      "required": ["source"],
      "properties": {
        "source": {
          "type": "string",
          "description": "Shader source path or URI parameter"
        },
        "type": {
          "$ref": "#/definitions/shader_source_type",
          "default": "glsl"
        },
        "entry_point": {
          "type": "string",
          "default": "main"
        },
        "uniforms": {
          "type": "object",
          "description": "Uniform variable declarations",
          "additionalProperties": {
            "type": "object",
            "properties": {
              "type": { "$ref": "#/definitions/data_type" },
              "value": {},
              "source": { "type": "string" }
            }
          }
        }
      }
    },
    "render_shader_config": {
      "type": "object",
      "description": "Multi-stage (vertex+fragment) shader configuration for render passes",
      "required": ["stages"],
      "properties": {
        "stages": {
          "type": "array",
          "description": "Ordered shader stages (vertex, fragment) making up this render pass's pipeline",
          "minItems": 1,
          "items": {
            "$ref": "#/definitions/shader_stage"
          }
        },
        "uniforms": {
          "type": "object",
          "description": "Uniform variable declarations, shared across all stages",
          "additionalProperties": {
            "type": "object",
            "properties": {
              "type": { "$ref": "#/definitions/data_type" },
              "value": {},
              "source": { "type": "string" }
            }
          }
        }
      }
    },
    "shader_stage": {
      "type": "object",
      "required": ["stage", "type", "source"],
      "properties": {
        "stage": {
          "type": "string",
          "description": "Which pipeline stage this shader source targets",
          "enum": ["vertex", "fragment"]
        },
        "type": {
          "$ref": "#/definitions/shader_source_type",
          "default": "glsl"
        },
        "source": {
          "type": "string",
          "description": "Shader source path or URI parameter for this stage"
        },
        "entry_point": {
          "type": "string",
          "default": "main"
        }
      }
    },
    "render_target": {
      "type": "object",
      "description": "Offscreen render-target/framebuffer config - all fields required, no schema defaults",
      "required": ["color_format", "depth_format", "width", "height", "clear_color", "clear_depth"],
      "properties": {
        "color_format": {
          "type": "string",
          "description": "Color attachment format",
          "enum": ["RGBA8", "RGB8"]
        },
        "depth_format": {
          "type": "string",
          "description": "Depth attachment format",
          "enum": ["D32_SFLOAT", "D24_UNORM_S8_UINT"]
        },
        "width": {
          "type": "integer",
          "minimum": 1
        },
        "height": {
          "type": "integer",
          "minimum": 1
        },
        "clear_color": {
          "type": "array",
          "description": "RGBA clear color",
          "items": { "type": "number" },
          "minItems": 4,
          "maxItems": 4
        },
        "clear_depth": {
          "type": "number",
          "minimum": 0,
          "maximum": 1
        }
      }
    },
    "vertex_layout_entry": {
      "type": "object",
      "required": ["name", "format", "offset"],
      "properties": {
        "name": {
          "type": "string",
          "description": "Vertex attribute name"
        },
        "format": {
          "type": "string",
          "description": "Vertex attribute component format",
          "enum": ["FLOAT32", "FLOAT16", "INT32"]
        },
        "offset": {
          "type": "integer",
          "description": "Byte offset within the vertex; stride is auto-computed from the tightly-packed sum of attribute sizes, not schema-configurable",
          "minimum": 0
        }
      }
    },
    "vertex_buffer": {
      "type": "object",
      "description": "Buffer binding that supplies vertex attribute data for vertex_layout entries, using the same prefix-notation convention as pass_io_binding",
      "required": ["source"],
      "properties": {
        "source": {
          "type": "string",
          "description": "Data source using prefix notation",
          "pattern": "^(input|output|internal|parameter):[a-zA-Z][a-zA-Z0-9_]*$"
        }
      }
    },
    "index_buffer": {
      "type": "object",
      "description": "Index buffer binding for render passes; index_type is schema-configurable per D-17",
      "properties": {
        "index_type": {
          "type": "string",
          "enum": ["uint16", "uint32"],
          "default": "uint32"
        },
        "source": {
          "type": "string",
          "description": "Data source using prefix notation",
          "pattern": "^(input|output|internal|parameter):[a-zA-Z][a-zA-Z0-9_]*$"
        }
      }
    },
    "pipeline_state": {
      "type": "object",
      "description": "Curated, minimal v1 fixed-function pipeline state subset (D-13); depth compare op is fixed at 'less', not schema-configurable (D-14)",
      "properties": {
        "topology": {
          "type": "string",
          "enum": ["triangle_list", "line_list", "point_list"],
          "default": "triangle_list"
        },
        "cull_mode": {
          "type": "string",
          "enum": ["none", "front", "back"],
          "default": "back"
        },
        "front_face": {
          "type": "string",
          "enum": ["cw", "ccw"],
          "default": "ccw"
        },
        "depth_test": {
          "type": "string",
          "enum": ["enabled", "disabled"],
          "default": "enabled"
        }
      }
    },
    "pass_io_binding": {
      "type": "object",
      "required": ["name"],
      "properties": {
        "name": {
          "type": "string",
          "description": "Binding point name"
        },
        "source": {
          "type": "string",
          "description": "Data source using prefix notation",
          "pattern": "^(input|output|internal|parameter):[a-zA-Z][a-zA-Z0-9_]*$"
        },
        "target": {
          "type": "string",
          "description": "Data target using prefix notation",
          "pattern": "^(output|internal):[a-zA-Z][a-zA-Z0-9_]*$"
        }
      }
    },
    "data_transform": {
      "type": "object",
      "required": ["type", "input", "output"],
      "properties": {
        "type": {
          "type": "string",
          "enum": [
            "normalize", "denormalize", "resize", "crop", "pad",
            "color_convert", "transpose", "flip", "rotate",
            "quantize", "dequantize", "custom"
          ]
        },
        "input": {
          "type": "string",
          "description": "Input data reference"
        },
        "output": {
          "type": "string",
          "description": "Output data reference"
        },
        "params": {
          "type": "object",
          "description": "Transform-specific parameters",
          "properties": {
            "mean": { "type": "array", "items": { "type": "number" } },
            "std": { "type": "array", "items": { "type": "number" } },
            "width": { "type": "integer" },
            "height": { "type": "integer" },
            "method": { "type": "string" },
            "color_space": { "type": "string" },
            "axes": { "type": "array", "items": { "type": "integer" } },
            "angle": { "type": "number" },
            "custom_function": { "type": "string" }
          }
        }
      }
    },
    "optimizer_config": {
      "type": "object",
      "required": ["type"],
      "properties": {
        "type": {
          "type": "string",
          "enum": ["adam", "sgd", "rmsprop", "adagrad", "adadelta", "adamw"]
        },
        "learning_rate": {
          "type": "number",
          "minimum": 0,
          "default": 0.001
        },
        "momentum": {
          "type": "number",
          "minimum": 0,
          "maximum": 1
        },
        "weight_decay": {
          "type": "number",
          "minimum": 0
        },
        "beta1": {
          "type": "number",
          "minimum": 0,
          "maximum": 1
        },
        "beta2": {
          "type": "number",
          "minimum": 0,
          "maximum": 1
        },
        "epsilon": {
          "type": "number",
          "minimum": 0
        }
      }
    },
    "data_type": {
      "type": "string",
      "enum": [
        "texture1D", "texture2D", "texture3D", "textureCube",
        "tensor", "float", "int", "bool", "vec2", "vec3", "vec4",
        "mat2", "mat3", "mat4", "buffer", "string"
      ]
    }
  }
}