{
  "name": "render-pass-happy-path",
  "version": "1.0.0",
  "gnus_spec_version": 1.0,
  "inputs": [
    {
      "name": "renderInput",
      "source_uri_param": "file://processing_dispatch/happy-path-vertex-data.raw",
      "type": "buffer",
      "dimensions": {
        "width": 1
      }
    }
  ],
  "outputs": [],
  "passes": [
    {
      "name": "renderPass",
      "type": "render",
      "render_shader": {
        "stages": [
          {
            "stage": "vertex",
            "type": "glsl",
            "source": "file://processing_dispatch/scalar_position_vertex_shader.glsl",
            "entry_point": "main"
          },
          {
            "stage": "fragment",
            "type": "glsl",
            "source": "file://processing_dispatch/solid_red_fragment_shader.glsl",
            "entry_point": "main"
          }
        ]
      },
      "render_target": {
        "color_format": "RGBA8",
        "depth_format": "D32_SFLOAT",
        "width": 8,
        "height": 8,
        "clear_color": [0.0, 0.0, 0.0, 1.0],
        "clear_depth": 1.0
      },
      "vertex_buffer": {
        "source": "input:renderInput"
      },
      "vertex_layout": [
        {
          "name": "inPosition",
          "format": "FLOAT32",
          "offset": 0
        }
      ],
      "pipeline_state": {
        "topology": "point_list",
        "cull_mode": "none",
        "front_face": "ccw",
        "depth_test": "disabled"
      }
    }
  ]
}
