{
  "name": "texture1d-tiny-test",
  "version": "1.0.0",
  "gnus_spec_version": 1.0,
  "author": "Test Author",
  "description": "A test processing definition for texture1D input using a tiny Conv1D model",
  "tags": ["texture1d", "signal", "test"],

  "inputs": [
    {
      "name": "inputSignal",
      "source_uri_param": "file://processing_datatypes/texture1d_input.raw",
      "type": "texture1D",
      "description": "Input 1D signal",
      "dimensions": {
        "width": 256,
        "block_len": 256,
        "chunk_stride": 256
      },
      "format": "FLOAT32"
    }
  ],

  "outputs": [
    {
      "name": "signalOutput",
      "source_uri_param": "file://processing_datatypes/texture1d_output.raw",
      "type": "tensor",
      "description": "Output tensor from 1D model"
    }
  ],

  "parameters": [
    {
      "name": "modelUri",
      "type": "uri",
      "default": "file://processing_datatypes/texture1d_tiny.mnn",
      "description": "URI to the tiny 1D MNN model"
    },
    {
      "name": "volumeLayout",
      "type": "string",
      "default": "HWD",
      "description": "Accepted but ignored for 1D"
    }
  ],

  "passes": [
    {
      "name": "texture1d_inference",
      "type": "inference",
      "description": "1D model inference",
      "model": {
        "source_uri_param": "file://processing_datatypes/texture1d_tiny.mnn",
        "format": "MNN",
        "batch_size": 1,
        "input_nodes": [
          {
            "name": "input",
            "type": "tensor",
            "source": "input:inputSignal",
            "shape": [1, 1, 256]
          }
        ],
        "output_nodes": [
          {
            "name": "output",
            "type": "tensor",
            "target": "output:signalOutput",
            "shape": [1, 2, 256]
          }
        ]
      }
    }
  ],

  "metadata": {
    "created_date": "2026-02-13",
    "framework": "MNN",
    "test_case": "texture1d_datatype"
  }
}
