{
  "name": "float-tiny-test",
  "version": "1.0.0",
  "gnus_spec_version": 1.0,
  "author": "Test Author",
  "description": "A test processing definition for float input using a tiny MLP model",
  "tags": ["float", "signal", "test"],

  "inputs": [
    {
      "name": "inputFloat",
      "source_uri_param": "file://processing_datatypes/float_input.bin",
      "type": "float",
      "description": "Input float vector",
      "dimensions": {
        "width": 512,
        "block_len": 64,
        "chunk_stride": 32
      },
      "format": "FLOAT32"
    }
  ],

  "outputs": [
    {
      "name": "floatOutput",
      "source_uri_param": "file://processing_datatypes/float_output.raw",
      "type": "tensor",
      "description": "Output tensor from float model"
    }
  ],

  "parameters": [
    {
      "name": "modelUri",
      "type": "uri",
      "default": "file://processing_datatypes/float_model.mnn",
      "description": "URI to the float MNN model"
    }
  ],

  "passes": [
    {
      "name": "float_inference",
      "type": "inference",
      "description": "Float model inference",
      "model": {
        "source_uri_param": "file://processing_datatypes/float_model.mnn",
        "format": "MNN",
        "batch_size": 1,
        "input_nodes": [
          {
            "name": "input",
            "type": "tensor",
            "source": "input:inputFloat",
            "shape": [1, 64]
          }
        ],
        "output_nodes": [
          {
            "name": "output",
            "type": "tensor",
            "target": "output:floatOutput",
            "shape": [1, 64]
          }
        ]
      }
    }
  ],

  "metadata": {
    "created_date": "2026-02-16",
    "framework": "MNN",
    "test_case": "float_datatype"
  }
}